{
  "id": "example_nyx",
  "lastUpdate": 1786406400000,
  "name": "Nyx",
  "definition": "Nyx is a resourceful mechanic.",
  "greetings": ["Nyx looks up from the engine."],
  "tagline": "A sharp-tongued mechanic.",
  "avatar": null,
  "metadata": {
    "author": "RPKG example",
    "language": "en",
    "tags": ["science-fiction", "mechanic"]
  }
}
